{
  "$schema": "https://json-schema.org/draft/2020-12/schema",
  "$id": "https://controls.slac.stanford.edu/schemas/screen-ir/1.0/schema.json",
  "title": "Canopy Screen IR",
  "description": "Canonical Canopy screen Intermediate Representation. Owned by @canopy/screen-ir; mirrors the TypeScript types in src/. This file is the structural subset of the contract; cross-field rules (macro defaults, the Rule union arm, formula:// resolution) are enforced by validate()'s semantic layer.",
  "type": "object",
  "additionalProperties": false,
  "required": ["schemaVersion", "kind", "id", "metadata", "macros", "root"],
  "properties": {
    "schemaVersion": { "const": "1.0" },
    "kind": { "enum": ["screen", "template"] },
    "id": { "type": "string" },
    "metadata": { "$ref": "#/$defs/ScreenMetadata" },
    "macros": { "type": "array", "items": { "$ref": "#/$defs/MacroDeclaration" } },
    "formulas": { "type": "array", "items": { "$ref": "#/$defs/FormulaDeclaration" } },
    "root": { "$ref": "#/$defs/WidgetNode" }
  },
  "$defs": {
    "ScreenMetadata": {
      "type": "object",
      "additionalProperties": false,
      "required": ["title", "source", "size"],
      "properties": {
        "title": { "type": "string" },
        "source": { "$ref": "#/$defs/ScreenSource" },
        "size": { "$ref": "#/$defs/ScreenSize" },
        "description": { "type": "string" },
        "author": { "type": "string" }
      }
    },
    "ScreenSize": {
      "type": "object",
      "additionalProperties": false,
      "required": ["width", "height"],
      "properties": {
        "width": { "type": "number" },
        "height": { "type": "number" }
      }
    },
    "ScreenSource": {
      "description": "Open by design: `type` is any string so the editor reads converter-stamped source types (e.g. 'edl-converter') forever. The named variants are documentation, not an exhaustive list.",
      "type": "object",
      "required": ["type"],
      "properties": {
        "type": { "type": "string" },
        "savedAt": { "type": "string" },
        "sourceFile": { "type": "string" },
        "convertedAt": { "type": "string" }
      }
    },
    "MacroDeclaration": {
      "description": "default required on a screen, forbidden on a template — enforced in validate(), not expressible here.",
      "type": "object",
      "additionalProperties": false,
      "required": ["name"],
      "properties": {
        "name": { "type": "string", "pattern": "^[A-Za-z][A-Za-z0-9_]*$" },
        "default": { "type": "string" },
        "description": { "type": "string" }
      }
    },
    "FormulaDeclaration": {
      "description": "Screen-level formula, referenced by name via formula://<name>.",
      "type": "object",
      "additionalProperties": false,
      "required": ["name", "expression"],
      "properties": {
        "name": { "type": "string" },
        "kind": { "enum": ["scalar", "timeseries", "waveform"] },
        "expression": { "type": "string" },
        "bindings": {
          "type": "object",
          "additionalProperties": { "type": "string" }
        }
      }
    },
    "Geometry": {
      "type": "object",
      "additionalProperties": false,
      "required": ["x", "y", "width", "height"],
      "properties": {
        "x": { "type": "number" },
        "y": { "type": "number" },
        "width": { "type": "number" },
        "height": { "type": "number" }
      }
    },
    "WidgetMeta": {
      "type": "object",
      "additionalProperties": false,
      "properties": {
        "comment": { "type": "string" }
      }
    },
    "WidgetNode": {
      "type": "object",
      "additionalProperties": false,
      "required": ["id", "type", "props", "geometry"],
      "properties": {
        "id": { "type": "string" },
        "type": { "type": "string" },
        "props": {
          "description": "Untagged JSON literals. Open by design: per-widget prop sets are not enumerated here. formula:// references live in designated channel props; resolution is checked in validate().",
          "type": "object"
        },
        "geometry": { "$ref": "#/$defs/Geometry" },
        "children": { "type": "array", "items": { "$ref": "#/$defs/WidgetNode" } },
        "rules": { "type": "array", "items": { "$ref": "#/$defs/Rule" } },
        "meta": { "$ref": "#/$defs/WidgetMeta" },
        "warnings": { "type": "array", "items": { "type": "string" } }
      }
    },
    "RulePvBinding": {
      "type": "object",
      "additionalProperties": false,
      "required": ["name", "trigger"],
      "properties": {
        "name": { "type": "string" },
        "trigger": { "type": "boolean" }
      }
    },
    "RuleCondition": {
      "type": "object",
      "additionalProperties": false,
      "required": ["expression", "value"],
      "properties": {
        "expression": { "type": "string" },
        "value": { "type": ["string", "number", "boolean", "null"] }
      }
    },
    "RuleScalar": { "type": ["string", "number", "boolean", "null"] },
    "Rule": {
      "description": "Discriminated union: conditional arm (pvs + conditions, what the converter emits) or formula arm (formula). validate() enforces exactly one arm.",
      "type": "object",
      "required": ["id", "name", "targetProperty", "default"],
      "oneOf": [
        {
          "additionalProperties": false,
          "required": ["id", "name", "targetProperty", "default", "pvs", "conditions"],
          "properties": {
            "id": { "type": "string" },
            "name": { "type": "string" },
            "targetProperty": { "type": "string" },
            "default": { "$ref": "#/$defs/RuleScalar" },
            "pvs": { "type": "array", "items": { "$ref": "#/$defs/RulePvBinding" } },
            "conditions": { "type": "array", "items": { "$ref": "#/$defs/RuleCondition" } }
          }
        },
        {
          "additionalProperties": false,
          "required": ["id", "name", "targetProperty", "default", "formula"],
          "properties": {
            "id": { "type": "string" },
            "name": { "type": "string" },
            "targetProperty": { "type": "string" },
            "default": { "$ref": "#/$defs/RuleScalar" },
            "formula": { "type": "string" }
          }
        }
      ]
    }
  }
}
